{
  "schemaVersion": 2,
  "workerId": "C0",
  "frozenSourceCommit": "4748fe04f19afdf6b27c4c12502b84db325e7294",
  "evidenceSubjectCommit": "3be52f0b0763cd0ba164b13914d8b0b4f37433e8",
  "evidenceSubjectTree": "5f50b480d39cbfbeb1ff74fab866b6a995418868",
  "createdAtUtc": "2026-08-31T00:21:35Z",
  "route": [
    "shared",
    "gguf",
    "openvino"
  ],
  "evidenceStatus": "mixed",
  "report": {
    "path": "docs/audits/2026-08-30/C0-r4-specialist-reconciliation.md",
    "sha256": "12442e775d2848ae58ede50455e760e5b7ec65b2a321e32e84d7a26bacc2f5fc",
    "bytes": 7422
  },
  "inputs": [
    {
      "kind": "git-commit",
      "id": "c0-subject-3be52f0b0763cd0ba164b13914d8b0b4f37433e8",
      "evidenceGrade": "verified"
    },
    {
      "kind": "git-bundle",
      "id": "C0-R4-REQUIRED-REFS-2026-08-30.bundle",
      "sha256": "378594b273d8143bc34ecefff1826593b386271b025a7151536540a004d9f742",
      "bytes": 22518915,
      "evidenceGrade": "verified"
    },
    {
      "kind": "worker-prompt",
      "id": "H1-R4-UCL-INTEL-MASTER-PROMPT",
      "sha256": "f09cd973e2da5321ef01dd3392206c49bcbe21da8d61d7d09219640bf29798cc",
      "bytes": 8098,
      "evidenceGrade": "verified"
    }
  ],
  "outputs": [
    {
      "kind": "issue-ledger",
      "id": "C0-r4-issue-ledger.md",
      "sha256": "8587ffb709866a8d3fe0c35cc49a3fc735ca90afd4a7d85e857ea391223ce3ee",
      "bytes": 3133,
      "evidenceGrade": "verified"
    },
    {
      "kind": "git-tree",
      "id": "c0-tree-5f50b480d39cbfbeb1ff74fab866b6a995418868",
      "evidenceGrade": "verified"
    }
  ],
  "commands": [
    {
      "id": "C0-CROSSFEATURE",
      "exitCode": 0,
      "discovered": 114,
      "executed": 114,
      "passed": 114,
      "failed": 0,
      "skipped": 0,
      "disposition": "passed"
    },
    {
      "id": "C0-DOWNLOAD-AUTH",
      "exitCode": 0,
      "discovered": 30,
      "executed": 30,
      "passed": 30,
      "failed": 0,
      "skipped": 0,
      "disposition": "passed"
    },
    {
      "id": "C0-MI-CONTRACTS",
      "exitCode": 0,
      "discovered": 428,
      "executed": 428,
      "passed": 428,
      "failed": 0,
      "skipped": 0,
      "disposition": "passed"
    },
    {
      "id": "C0-COMPATIBILITY",
      "exitCode": 0,
      "discovered": 1062,
      "executed": 1062,
      "passed": 1062,
      "failed": 0,
      "skipped": 0,
      "disposition": "passed"
    },
    {
      "id": "C0-HARDWARE-FOUNDATION",
      "exitCode": 0,
      "discovered": 234,
      "executed": 234,
      "passed": 234,
      "failed": 0,
      "skipped": 0,
      "disposition": "passed"
    },
    {
      "id": "C0-MI-TRANSPORT",
      "exitCode": 0,
      "discovered": 27,
      "executed": 27,
      "passed": 27,
      "failed": 0,
      "skipped": 0,
      "disposition": "passed"
    },
    {
      "id": "C0-MI-WORKER",
      "exitCode": 0,
      "discovered": 78,
      "executed": 78,
      "passed": 78,
      "failed": 0,
      "skipped": 0,
      "disposition": "passed"
    },
    {
      "id": "C0-MI-WORKERCLIENT",
      "exitCode": 0,
      "discovered": 121,
      "executed": 121,
      "passed": 121,
      "failed": 0,
      "skipped": 0,
      "disposition": "passed"
    },
    {
      "id": "C0-OPENVINO-PACKAGING",
      "exitCode": 0,
      "discovered": 11,
      "executed": 11,
      "passed": 4,
      "failed": 0,
      "skipped": 7,
      "disposition": "mixed"
    },
    {
      "id": "C0-UNITTESTS-BUILD",
      "exitCode": 0,
      "discovered": 0,
      "executed": 0,
      "passed": 0,
      "failed": 0,
      "skipped": 0,
      "disposition": "passed"
    },
    {
      "id": "C0-PACKAGE-BUILD",
      "exitCode": 1,
      "discovered": 0,
      "executed": 0,
      "passed": 0,
      "failed": 0,
      "skipped": 0,
      "disposition": "blocked"
    }
  ],
  "blockers": [
    "The exact pinned GGUF quantizer stage is absent, so the ordinary Release/package target fails closed before packaging.",
    "Seven controlled OpenVINO packaging tests skip because their verified native-stage inputs are unavailable.",
    "The WinUI UnitTests DLL cannot execute outside package context on this machine and reports REGDB_E_CLASSNOTREG."
  ],
  "nonClaims": [
    "No signed-package installation or Windows Application Control acceptance is claimed.",
    "No authoritative Intel-native GGUF, OpenVINO, TurboQuant, performance, screenshot, or accessibility acceptance is claimed.",
    "This preliminary checkpoint is not E1 release acceptance and main was not merged or pushed."
  ]
}
